{
  "schema": "openprose.skill-runtime-image-manifest/1",
  "imageFormatVersion": "openprose.skill-runtime-image/1",
  "imageVersion": "published-kernel-template",
  "languageVersion": "0.1.0-rc.1",
  "skillVersion": "published-kernel-v1",
  "runtimeContractVersion": "native-output-v1",
  "semanticSourceRevision": "bbb2f13c31bec57b17c7979415794112fa688b4e",
  "purpose": "canonical-language-runtime",
  "releaseEligible": false,
  "normalization": {
    "encoding": "utf-8",
    "newlines": "lf",
    "byteOrderMark": "forbidden",
    "pathSeparator": "/"
  },
  "payload": [
    {
      "path": "payload/kernel.md",
      "mediaType": "text/markdown; charset=utf-8",
      "byteLength": 5632,
      "sha256": "f4a133bd41f8bf42433ccf26dc48440b6ec692512e04caaa1687d42e5ec2f345"
    }
  ],
  "modelVisibleBytes": {
    "serialization": "ordered-raw-concatenation-v1",
    "byteLength": 5632,
    "sha256": "f4a133bd41f8bf42433ccf26dc48440b6ec692512e04caaa1687d42e5ec2f345"
  },
  "aggregateSha256": {
    "algorithm": "sha256-path-length-nul-v1",
    "sha256": "6cd37fd568df61026688ca2e3f684dbf76e1a51fa8a67fbd832f6225bbb81cb7"
  },
  "instructionPlacements": [
    {
      "id": "developer",
      "strictness": "strict",
      "preservesHarnessBasePrompt": true
    },
    {
      "id": "system-append",
      "strictness": "strict",
      "preservesHarnessBasePrompt": true
    }
  ],
  "taskEnvelope": {
    "schemaId": "openprose.task-envelope/1",
    "path": "contracts/task-envelope.schema.json",
    "sha256": "8e3ddfe3dff60ef7ba9df67133214ed7cd265839d363c5d4c76589eebf7b9de4"
  },
  "oneFieldFraming": {
    "id": "imp-008-unused-framing/1",
    "path": "contracts/framing.txt",
    "sha256": "93cdd25d1c29aecfdfe529a1b40f5a95a28a6bbd6e4da21d943e0db1cb3797cf"
  },
  "terminalEnvelope": {
    "schemaId": "imp-008-unused-terminal/1",
    "path": "contracts/terminal.schema.json",
    "sha256": "26e8c88a98a9cda715ad0cfdc050005c58035b727508310a7cb01f1c0bfcee3b"
  },
  "minimumTransportRequirements": {
    "nonInteractive": "required",
    "structuredOutput": "required",
    "ambientIsolation": "required",
    "terminalEnvelope": "required",
    "boundedStreaming": "required"
  }
}
